video_id,entity,type,subtypes,DBpedia_URL,relevance,sentiment_label,sentiment_score,emotion_sadness,emotion_fear,emotion_joy,emotion_disgust,emotion_anger,count,is_entity,lemma,porter_stem,snowball_stem,lancaster_stem,porter_stem_notprocessed,snowball_stem_notprocessed,lancaster_stem_notprocessed,Wikipage,vader_compound,vader_neg_score,vader_pos_score,vader_neu_score,textblob_polarity,textblob_subjectivity,ibm_sentiment_label,ibm_sentiment_score,ibm_anger,ibm_joy,ibm_sadness,ibm_fear,ibm_disgust,google_sentiment_score,google_sentiment_magnitude,topic,publishedAt,channelId,title,description,channelTitle,tags,duration,duration_seconds,duration_minutes
V22IMLtlmRI,John McCain,Person,"Politician, AwardWinner, MilitaryPerson, Senator, U.S.Congressperson, FilmActor, TVActor",http://dbpedia.org/resource/John_McCain,0.521536,positive,0.897567,0.149836,0.059815,0.152497,0.198354,0.06865,1,1,John McCain,John McCain,John McCain,John McCain,john mccain,john mccain,john mccain,http://en.wikipedia.org/wiki/John_McCain,0.9725,0.0,0.254,0.746,0.3090909090909091,0.5159090909090909,positive,0.617032,0.13508699999999998,0.489687,0.489063,0.564909,0.130092,0.10000000149011612,1.100000023841858,Free Trade,2008-06-30T22:17:24.000Z,UCEyLs_rjU7gwtUNJR4wtjEQ,Colombia Free Trade,"Go to http://www.youtube.com/johnmccaindotcom to watch more John McCain YouTube videos.

You can receive the latest official YouTube videos from the McCain campaign by watching this video or going tohttp://www.youtube.com/johnmccaindotcom, logging on to your YouTube account, and clicking ""Subscribe"" just above the box where this message is displayed on the page.

Subscribe today, and tell 10 of your friends to join you in subscribing.

John McCain for President: http://www.JohnMcCain.com",John McCain,"john', 'mccain', 'web', 'ad', 'columbia', 'free', 'trade', 'agreement', 'economy', 'jobs', 'mexico', 'central', 'america', 'gop', 'johnmccaindotcom', 'barack', 'obama'",PT30S,30,1
V22IMLtlmRI,Mexico Canada Central America,Company,NONE,NONE,0.507102,negative,-0.548088,0.561148,0.200489,0.150396,0.089318,0.156802,1,1,Mexico Canada Central America,Mexico Canada Central America,Mexico Canada Central America,Mexico Canada Central America,mexico canada central america,mexico canada central america,mexico canad cent americ,NONE,0.9725,0.0,0.254,0.746,0.3090909090909091,0.5159090909090909,positive,0.617032,0.13508699999999998,0.489687,0.489063,0.564909,0.130092,0.10000000149011612,1.100000023841858,Free Trade,2008-06-30T22:17:24.000Z,UCEyLs_rjU7gwtUNJR4wtjEQ,Colombia Free Trade,"Go to http://www.youtube.com/johnmccaindotcom to watch more John McCain YouTube videos.

You can receive the latest official YouTube videos from the McCain campaign by watching this video or going tohttp://www.youtube.com/johnmccaindotcom, logging on to your YouTube account, and clicking ""Subscribe"" just above the box where this message is displayed on the page.

Subscribe today, and tell 10 of your friends to join you in subscribing.

John McCain for President: http://www.JohnMcCain.com",John McCain,"john', 'mccain', 'web', 'ad', 'columbia', 'free', 'trade', 'agreement', 'economy', 'jobs', 'mexico', 'central', 'america', 'gop', 'johnmccaindotcom', 'barack', 'obama'",PT30S,30,1
